Sheet: Access Grid
A1: Employee Class\Location Type | B1: Executive Lounge | C1: Executive Washroom | D1: Supply Closet | E1: Employee Lounge | F1: Server Room | H1: Employee class | I1: Number of accessible location types
A2: Managers | B2: 1 | C2: 1 | H2: of:=[.A2] -> Managers | I2: of:=COUNT([.B2:.F2]) -> 2
A3: Administrative Assistants | B3: 1 | D3: 1 | E3: 1 | H3: of:=[.A3] -> Administrative Assistants | I3: of:=COUNT([.B3:.F3]) -> 3
A4: Information Technology Employees | E4: 1 | F4: 1 | H4: of:=[.A4] -> Information Technology Employees | I4: of:=COUNT([.B4:.F4]) -> 2
A5: Clerks | D5: 1 | E5: 1 | H5: of:=[.A5] -> Clerks | I5: of:=COUNT([.B5:.F5]) -> 2
A6: Collegiate Interns | E6: 1 | H6: of:=[.A6] -> Collegiate Interns  | I6: of:=COUNT([.B6:.F6]) -> 1
A7: Maintenance Crew | B7: 1 | C7: 1 | D7: 1 | E7: 1 | F7: 1 | H7: of:=[.A7] -> Maintenance Crew | I7: of:=COUNT([.B7:.F7]) -> 5
A8: Visitors | B8: 1 | C8: 1 | E8: 1 | H8: of:=[.A8] -> Visitors | I8: of:=COUNT([.B8:.F8]) -> 3
A11: Location Type | B11: of:=[.B1] -> Executive Lounge | C11: of:=[.C1] -> Executive Washroom | D11: of:=[.D1] -> Supply Closet | E11: of:=[.E1] -> Employee Lounge | F11: of:=[.F1] -> Server Room
A12: Employee classes that have access to this location type | B12: of:=COUNT([.B2:.B8]) -> 4 | C12: of:=COUNT([.C2:.C8]) -> 3 | D12: of:=COUNT([.D2:.D8]) -> 3 | E12: of:=COUNT([.E2:.E8]) -> 6 | F12: of:=COUNT([.F2:.F8]) -> 2

Sheet: Tables
A1: Employee | F1: PersonType | I1: LocationType | L1: PersonLocationAccess
A2: EmployeeID | B2: LName | C2: DateJoined | D2: PersonType | F2: TypeID | G2: TypeName | I2: TypeID | J2: TypeName | L2: PersonTypeID | M2: LocationTypeID
A3: PK | D3: FK(PersonType.TypeID) | F3: PK | I3: PK | L3: FK(PersonType.TypeID) | M3: FK(LocationType.TypeID)
A4: INT | B4: VARCHAR | C4: DATE | D4: INT | F4: INT | G4: VARCHAR | I4: INT | J4: VARCHAR | L4: INT | M4: INT
A5: --- | B5: --- | C5: --- | D5: --- | F5: --- | G5: --- | I5: --- | J5: --- | L5: --- | M5: ---
A6: 101 | B6: Pappas | C6: 2008 | D6: 0 | F6: 0 | G6: Managers | I6: 0 | J6: Executive Lounge | L6: 0 | M6: 0
A7: 102 | B7: George | C7: 2012 | D7: 3 | F7: 1 | G7: Administrative Assistants | I7: 1 | J7: Executive Washroom | L7: 0 | M7: 1
A8: 103 | B8: Chang | C8: 2003 | D8: 2 | F8: 2 | G8: Information Technology Employees | I8: 2 | J8: Supply Closet | L8: 1 | M8: 0
A9: 999 | B9: Davidson | C9: 2000 | D9: 6 | F9: 3 | G9: Clerks | I9: 3 | J9: Employee Lounge | L9: 1 | M9: 2
A10: 105 | B10: Emerson | C10: 2001 | D10: 3 | F10: 4 | G10: Collegiate Interns | I10: 4 | J10: Server Room | L10: 1 | M10: 3
A11: 106 | B11: Little | C11: 2000 | D11: 4 | F11: 5 | G11: Maintenance Crew | L11: 2 | M11: 3
A12: 107 | B12: Rodriguez | C12: 2004 | D12: 2 | F12: 6 | G12: Visitors | L12: 2 | M12: 4
L13: 3 | M13: 2
L14: 3 | M14: 3
L15: 4 | M15: 3
L16: 5 | M16: 0
L17: 5 | M17: 1
L18: 5 | M18: 2
L19: 5 | M19: 3
L20: 5 | M20: 4
L21: 6 | M21: 0
L22: 6 | M22: 1
L23: 6 | M23: 3