Sheet: Sheet1
A1: index | B1: month | C1: values | E1: deviation | F1: squared dev | G1: sum of squared devs
A2: 1 | B2: January | C2: 20 | E2: of:=[.$C2]-[.$A$10] -> -8.33333333333333 | F2: of:=[.E2]^2 -> 69.4444444444444 | G2: of:=SUM([.F2:.F7]) -> 129.333333333333
A3: 2 | B3: February | C3: 26 | E3: of:=[.$C3]-[.$A$10] -> -2.33333333333333 | F3: of:=[.E3]^2 -> 5.44444444444444
A4: 3 | B4: March | C4: 28 | E4: of:=[.$C4]-[.$A$10] -> -0.333333333333332 | F4: of:=[.E4]^2 -> 0.11111111111111
A5: 4 | B5: April | C5: 31 | E5: of:=[.$C5]-[.$A$10] -> 2.66666666666667 | F5: of:=[.E5]^2 -> 7.11111111111112
A6: 5 | B6: May | C6: 35 | E6: of:=[.$C6]-[.$A$10] -> 6.66666666666667 | F6: of:=[.E6]^2 -> 44.4444444444445
A7: 6 | B7: June | C7: 30 | E7: of:=[.$C7]-[.$A$10] -> 1.66666666666667 | F7: of:=[.E7]^2 -> 2.77777777777778
A9: mean
A10: of:=SUM([.C2:.C7])/COUNT([.C2:.C7]) -> 28.3333333333333
E11: variance | F11: Population stdev
E12: of:=[.G2]/COUNT([.C1:.C7]) -> 21.5555555555556 | F12: of:=SQRT([.E12]) -> 4.64279609239471
E14: sample variance | F14: sample stdev
E15: of:=[.G2]/(COUNT([.C1:.C7])-1) -> 25.8666666666667 | F15: of:=SQRT([.E15]) -> 5.08592829940284